{
  "schemaVersion": "pedantic.operation-plan.v1",
  "planId": "plan-1",
  "operationId": "operation-1",
  "profileId": "default",
  "targetId": "target-1",
  "resolvedSettings": {
    "rebootAllowed": {
      "value": false,
      "source": "target"
    },
    "retryLimit": {
      "value": 3,
      "source": "plan"
    }
  },
  "steps": [
    {
      "stepId": "validate",
      "stage": "preparation",
      "capability": "dsc.config.validate/v1",
      "dependsOn": [],
      "retryClass": "safe",
      "inputDigest": "sha256:aaaaaaaaaaaaaaaaaaaaaaaaaaaaaaaaaaaaaaaaaaaaaaaaaaaaaaaaaaaaaaaa",
      "secretReferences": ["secret/db-password"]
    }
  ]
}
